258,"What happened to the full editor??!!! Went to create a blog post today using my WordPress app and discovered that the editor is some weird, useless version of what it was before. I can't do anything in it like I can in the web based editor such as indent, center, size/place images, etc....literally every major function but basic typing is gone. Where did it go and how do I get it back? If this is not fixed I am uninstalling the app as it is totally useless to me without the full version of the editor. As well, the web based editor crashes EVERY SINGLE TIME I do an update to a blog. Makes editing virtually impossible. - - - I received an automated response to this review which said, ""You can switch back to the app's old editor: Go to App Settings in the app and toggle off the 'Show Visual Editor' option. However, some of the features you mentioned (such as indenting or aligning text) weren't part of the old editor, either."" - - - Found the setting. That leaves ONLY the HTML editor and does not fix the problem...at all. And, previously, before this change, the editor in my app and the web based editor were identical in their features.",,
259,"I use the app since 5y while being on the road. The maps are awesome and are showing most of the time even small bush tracks. The search for location names is annoying from time 2 time as you see it on the map when you zoom in but can't search for it. The voice guide is not accurate too often and that's the main reason for 3 stars. Not able to say the correct exit in plenty of roundabouts, slight left/right on straigth roads or on 180degrees corners or in roundabouts when to go straight",,
260,"Doesn't allow you to read the page's Edit history or Talk page. So practically only useful for reading, not editing.",,
261,"Has some serious usability issues. The main problem is the way tables are rendered on a small screen: they're very difficult to scroll horizontally and the rows cannot be sorted by column. Also, when editing an article, this app trashes edits, without warning, if a browser or other app loads another article.",,
262,Using an LG G3 (with a custom Nougat rom; CRDroid) and I'm getting just black where the map should be. It seems to be interactable (I can tap on invisible things in the darkness and get interaction with buildings).  The traffic toggle and zoom buttons etc are visible. The compass direction shows if I search for a place. I just can't see anything on the actual map view itself.  Is there anything I can try to fix this?,,
263,"I AM SO SORRY I EVER INSTALLED IT. This app is malfunctioning in several ways, relating to strange displays of blog text. Once OVERLAPPING so the post displayed UNDER or OVER the photo of prior post. The next time, yesterday, so the text displayed WAY OUT TO THE RIGHT. Reader has to swipe far, far to the keft to view it. What a disaster for a writer trying to create a following of readers.",,
264,"Frustrating and great. Frustrating: Does not inform me of turns soon enough. I expect to know immediately after I make a turn what is next (coming from google/here maps which do this). Not knowing when you check for the next turn makes me check the app too often which is dangerous. Great: Fast, availability to quickly adding places to open street maps, availability to download small parts of map. FYI: I don't use voice as I am on a motorcycle .",,
265,I've relied on maps.me for a long time as an offline backup to google maps and it has served me well. Sadly the current iteration has push notifications with no obvious setting to disable. While I can disable all notifications from the app at the system level this does not bode well for the direction of this apps development. I will be searching for an alternative.,,
266,"Really enjoy building my travel blogs, other friends use it too. Easy to use and set up. Update - unfortunately have fallen out of love with this app. When your posts get to a certain size, the app just slows down and becomes too laborious to edit. Ive tried on my tablet and phone and it's the same. Asked for help but they can't seem to solve. Tested each time it updates but still the same issue.",,
267,"Used to be the best map. Great features, easy to use, but it has ONE MAJOR BUG that has been there for 2 years - they sometimes solve it, most of the time they mess it up.  It is a very simple thing : the option to save maps to SD CARD.  Sometimes an update would relocate your maps to the phone, sometimes it would delete all maps, sometimes you had to uninstall and reinstall, sometimes ....  This time they have surpassed it : it moved all my SD CARD maps to memory, filling it right up!! And today there is no option to locate maps to SD CARD any more.  2 years and they still can't get this simple but ABSOLUTELY CRITICAL feature to hold.  So, finally, I'm done and, guess what, in doing so, after trying 8 apps I have found an even better one :  HERE MAPS.",,
268,"I've been using Habitica for a few years now and while I love the idea, from a technical standpoint the mobile app is broken. It feels like something you would have on your phone back when touchscreens were a new thing. The most annoying bugs are: party screen not updating after you accept a quest invitation so you're not sure if you accepted it, spamming buffs sometimes reduces your mana without actually applying the buff and party chat not updating (have to restart the app to see new messages)",,
269,"Was good under Nokia, now ruined Used to a fantastic app, now new owners have botched it up as expected.  ""Oops no results""?? For every address typed in in my city. Only finds street names. Not much help if I can't put in the number. Yes, I've tried every way of searching.",,
270,"Pixel 2 (Stock Android) Feb/2019: Looks promising but app rarely works properly. Even while traveling abroad, Google Maps Offline worked great but MAPS.ME Offline did not work at all - couldn't even find my location, let alone use navigation. You may have a different experience than I did but I cannot rely on it, and hence, will not recommend it. Hope they fix the issues.",,
271,"What happened The app was good but these recent changes have turned into something it's not. Why do I have and endless scrolling page? This isn't Facebook. And why trending articles? I didn't open up Wikipedia to read random things people have read. I do it to read the random things I want to read. Also the ongoing events section was an easy way to keep an eye on large geopolitical events. Now the page is mired in junk. That all said, it's still Wikipedia and serves the function it is intended for.",,
272,"Please fix the app. I enjoy using this app very much and use it regularly for every single initial query I make about any subject. Nearly every subject I look up is covered and many are covered in extreme depth.  The apps features mostly all work fine. I have noticed a tendency to crash when too many tabs are opened simultaneously or when hopping from hyperlink to hyperlink.  However, the single biggest flaw is the reading list feature. Not only does it usually crash every time I try to create one but it also won't let me log in. So I can't edit anything, contribute anything or save any reading lists. This need to be fixed.",,
273,"I truly love the wikipedia app, but suddenly the crowned feature, the Places tab, is missing from my version. This feature placed nearby articles on an interactive map. It helped me navigate new cities, and turned the world into a museum. I loved it. It's necessary. I can't for the life of me figure out why it'd be removed. A light has been lost in my life, hence the dim star rating. With it, it'd be 5 stars. Without it, only suffering.",,
274,No more than ok I tried this application offline before going on a trip abroad (did not actually navigate with it). Seems ok for a free application but: 1. Apps like Google Maps have many more interest points 2. The support of navigating between 2 points that are not my current location is not good. For example the source and destination names are not properly shown 3. The selected route did not use highways for some reason. There was no option to configure and control that,,
275,"This app does not provide audio navigation Be WARNED YOU MAY CRASH USING IT. OR FINED BY POLICE. The maps are accurate but the nav line hides the junctions. Road name are difficult to see at a glance. If you have a driving buddy it would be ok. many thanks for the update, will try it again in the future as and when it has audio also.",,
276,"Really not that great... I used this app for quite some time now and while does contain a few features that are better than on the website I like using the website on my phone's chrome more because here I can read random articles, open links in New tabs to quickly look up an unclear term and also does it remember to where I ha e read already.",,
277,"i could never make it to synch my reading lists from the original device where I saved them to other devices. now I changed phone and they are gone. such a shame. I had spent much time collecting those articles. and then the fact that you cannot access the reading lists from a normal browser is a little bit ridiculous....sorry Wikipedia, I love you in general but this app needs improvement. i would love to be able to continue to use it effectively across all platforms and devices.",,
278,"After installing the app it showed my location and the street name was completely wrong. I wanted to see what routes it would offer me to my father's village, but a search by the name of the village did not yield any results. Uninstalled.",,
279,"Very poor. The most ridiculous and non-functional app I've ever seen. There are so many bags I cannot even name! I cannot upload any photo, the scale of new post creation page is over sized that I can't see all the options. The navigation is enormously vague. I don't see comments I've made and blogs I follow. Finally the app crashes all the time. Well... The raw job. It's irritating.",,
280,"Plus: -detailed maps -no inaccuracies in the map material found Cons: -localisation doesn't work properly (when not connected to a wifi network, which typically is the case on the road): it takes very long before it finds a location at all, and in the end the result can still be 500 m wrong. (with other apps (here and google maps) it does work, so it's not the hardware). Minor remark: I personally prefer the old look of the bookmark pins.",,
281,"App works well for city nav The app works well for small scale, city navigation, and has very detailed maps for that. However, for trying to decide a route around the country, it's not the best. When you're very zoomed out, you can't see any of the roads or cities at all. This makes it almost worthless for countrywide navigation or route planning.",,
282,"Very nice detailed map program. Today I used it for routing, I would not recommend this app for route planning. Some tips: If you know youre global route download the maps for routing. Second: while driving the application is very keen on directing you to a motorway. Once decided which motorway to us, the app is willing to direct you a few miles in the wrong direction instead of choosing the shortest/fasted link. Also I noticed that is does direct you to closed roads (andosm use the same maps not having this problem). Last: In the options I noted that I do not want to use an internet connection, why is a popup occuring when I am driving stationg that I do not have Internet enabled?",,
283,"Unusable I can't leave the home page. Search shows me article titles, but tapping does nothing. Links into the app open on the home screen. If I can't read articles, it's useless.",,
284,"This app makes more connection attempts than probably the next 10 apps combined. Even before doing anything with it, and without running it, it's CONSTANTLY trying to contact Facebook & Google & who knows what else. They blame it on the SDK, but a) it shouldn't be doing it when I haven't even launched the app in forever, and b) other apps aren't nearly as bad. Pretty much every other app shows a handful of attempts, this one goes on for pages. & huge app size for what it is.",,
285,Uploading media does not work properly. Some files do not upload and the app does not resume automatically which is annoying. But even worse: Some files are uploaded several times if you try to re-upload and then you end up with duplicates. Also if the app closes in the background it starts uploading all media of a post again. There is also no source editing. Recently it just started crashing in the media library. In summary the media upload is useless.,,
286,Desperately needs an overhauling This used to be a four star app but has become into something that instantly reminds you of the good ol Gingerbread days. Please switch to Androids modern menu layout that's being used by so many decent apps. Why is there still menu key in the bottom bar? Move it to the side and make it swipeable. Also horizontal scrolling is a mess. As in nonexisting. 90 percent of all articles could easily be scraped since there's no way to read them properly. The website is so much better.,,
287,"I really like having access to OSM and this app works well for that. However search is slow and inaccurate .. But the most frustrating thing is map update. This takes hours and they should allow it to be done with a PC Also, like Sergey below I feel annoyed that I paid for an app to remove adverts but they are back as it's now free.",,
288,Happy user of maps.me for years. Today route planning started crashing the app. Unable to fix by deleting maps and reinstalling app several times. Unfortunately I have to give it up for Google maps. Still useful for viewing maps and pins. Sad day...,,
289,"Cant enter street address numbers. The street I live on is literally listed in the wrong town. It shows up on the map properly in the correct place, but you have to enter the neighboring town to find it. 100% failure on the first search i ever tried.",,
290,"Change their business model to a subscription. I purchased this app for all my devices Android and iOS. At the time there where no additional fees, ads or subscriptions. Now this app has ads and to get rid of them you have to pay a monthly subscription. They changed the rules in the middle of the game, I'm deleting it from all my devices. This app works offline after you download maps. Searching for an address is not good. You can import KMZ files, such as places you've mark in Goolge Maps.",,
291,This used to be a good app. Now it refuses to update the routes in certain parts of the uk and now is impossible to use to get to anywhere but the 4 places in the country that can be updated. I used this for work and now its totally useless. I've tried uninstalling and reinstalling but its exactly the same. If this isn't fixed I'll be deleting the app permanently. At this moment in time I would not recommend this app to even my worst enemy (yes it really is that bad!!),,
292,"While travelling in UK and Ireland we ran into a number of occasions where  voice directions were opposite to the visual ques. The visuals being  corrected on all occasions. We switched to Here, but MAPS.ME has superior  search capabilities. The addition of speed limits, route preferences, and  improving the time it takes to come up with a modified route would  definitely help. Nothing like being directed down country lanes in Britain  when two lane road options could have been taken.",,
293,"I love it except, and this is a big issue for me, it's totally server based. Want to update anything, but have a bad internet connection? Too bad, it's either going to take forever or fail. I would use and maybe even pay for this app to just have a way to have everything first be saved on my device. So, back to hunting for a to-do app. Edit 3/23: I have to drop my review on this to 1 star. You can manually edit values within the app for stats making any it unreasonable that I need internet.",,
294,"Good app but why can't I select my starting point, It always take the the starting point as the current location. There should be an option to select my starting location of my choice. And lot of  places are missing , not really reliable like Google map. Offline line good after dropping a pin at a place after getting the location from Google map. Ui needs to be improved. ""Setting"" closes after twice back press.",,
295,"The idea is wonderful. But a lot of tedious mistakes spoil the whole impression. For example, information is slowly updated even within the application, often clicking on a menu item is ignored. If you create a task without a title, but with a list, it will become closed for editing, just delete. Not all things are obvious. I had to read help to solve simple questions. Well, the old-school 8-bit graphics - not everyone likes it.",,
296,"Used to be a great app. Latest update makes it useless offline. For me this is huge, I only use this app offline. Won't recognize bookmarked places or any places searched for. Plus part of app is in Chinese, even though English is selected. I'll update my review if it's fixed soon.",,
297,"Not working without internet I was in rome last weekend,and i downloaded this app,to use it offline on my xperia z3. I downloaded all the maps, and when i got there,all i got was the message that my location was unavailable,and that i should switch it on in location settings. All of the location settings was on,as always,but for some reason, this app couldn't work. I found wifi nearby,downloaded other app that had offline Rome maps,and used that one. I dont know why this didn't worked, but this app put me in very uncomfortable position",,
298,"Update: in the past this was number one app for travel for me. But lately it led us to so wrong directions that is un acceptable for an app that is so popular. Sorry maps me, but we ended outside main road just because of you, ending in a risky situation for all of my family! Old review: Better than gmaps. You dowload the region and enjoy. If travel then you must have this app.",,
299,"This latest version no longer lets me share an article from a web browser into a new post. It always gives me a blank post where, before, it set the post title to the article title and placed a link to the article in the body of the post. This app is pretty useless to me until it's fixed.",,
300,"I tried this app over a year ago and I couldn't get it to work with my domain. I decided to try again and this time it worked. I love being able to post at any time without being on my computer. The only issues I'm having are that I have yet to be able to upload a picture. I think this feature is worth one whole star. I tried uploading a picture on my provider network and over WiFi, neither worked. The other issue I'm having is that I can't seem to check categories for my post. I have to log in through my browser to do that. It may be user error but I couldn't find that option. All in all, it works for generic text posts - at least for me. I'll take that over NOTHING!",,
301,"Good app to read Wikipedia articles, although some content (like long mathematical formulas) is cut off on small screens. Unfortunately there is no option to not save the history or previous searches.",,
302,"Sub-par for offline use. TTS is used, but it does not say street names. It does not offer alternate routes, and is slow too recalculate if you leave the offered route, so it keeps giving old route directions until it sorts it out, which is confusing. It cannot do offline address search. Other options do all of this better.",,
303,"All of a sudden i literally cant search for anything. It was telling me that the search engine is busy. And now if i simply type a single letter into the search bar, even without pressing search, it gives me an error code.",,
304,"I installed the map again on Feb 2020 in Toronto. All the street names are blacked out. Map in unusable. I deleted it. May try again when problem is resolved. Map is accurate but too simple interface. Lacks basic functionality. Can not have alternate route, choose b/w toll and free route, save route.",,
305,"Awful. it'll never give you the information you need. Stick with Google Maps. You can Download maps offline on Google too. I tried finding the public transport options from one city to the next (takes about one hour) but your app said ""This route is too far for pedestrians to walk"", 1, i wasn't asking for walking directions and 2, who are you to say what's too far. People have walked around the earth.",,
306,"Not very good Way too many roads missing. Until they are better updated Google Maps is the better way to go. And strangely enough, when you put in the street number first before the name, it says Street not found?!?!",,
307,"Major bug needs to fixed Unable to get back to home page after reading an article. Clicking the x at top left just closes the app. Sometimes takes me to the home page, but usually doesn't. So I can't access the history tab, nor access the feedback page to report this issue.",,
308,"Ever since the block editor was introduced, editing images and aligning it the way I want it to be is tough on my phone and I have to rely on my laptop for it. There's a particular layout I prefer and despite whatever tweaking I do, when the post is published, things aren't aesthetically how I want them to be. Earlier I had the freedom to just type stuff out and add images and publish it. Of course less options existed for formatting&alignment. The app is still quite user-friendly though.",,
309,"Doesn't upload and deletes posts It will upload small posts with no pictures in them, but as soon as I attempt to upload a longer post with photos it starts a never ending upload which never actually finishes. Then when you go back into the app to see what is going on it deletes the post you were trying to upload and you are left with only the title and the knowledge that you have entirely wasted your time and need to write the whole thing and locate all the media files again. Totally frustrating. It worked fine on iOS.",,
310,"There should be a way to manage saved posts (sort them, put into collections, etc.). Moreover, the number of saved posts shouldn't be limited. Actually the old ones don't get unsaved (when I view them on browser, then choose ""View in Reader"", the posts are still marked as ""Saved"") but they are not displayed in Saved posts so I can't access them offline (which is the reason I use the save function). And when visiting someone's blog, I prefer seeing an outline of their posts, which can help me access ANY post of that person, over an incomplete list of posts sorted chronically which doesn't display all of their posts (some of them are only accessible on the app through browser, so what's the point of using the app over browser?)",,
311,Terrible. Keeps coming up with couldnt sink doesnt show me any of my blogs. cant go on setting cant post nothing the only thing that works is view my site. It worked the first day i downloaded the app then i did some work to my site put some posts on etc and after that the app just went terribly wrong. whoever runs this app seriously need to fix it coz its just a joke. if i want to blog when im out and dont have a laptop with me i cant coz this app dont work. Sort this App out now!!!,,
312,"Latest Update Ruins App When I search for articles, I can not see them. I am stuck on the home page with the cards. The articles I searched for appear in history but I cannot actually see them to read them.",,
313,"More frustrating than useful, non-user friendly, glitchy Can't see anything on the page where you type your blog on the app, with the keypad obscuring everything even when I'm not typing. Today (which was also only the second time), when I posted on my blog, WP wouldn't let me reposition images inside the article after adding descriptions to them, both on the app and the website and I had to add an additional note at the beginning of my article explaining the images, compromising its structure. I'm new to WP and intend to write more, so please fix these asap.",,
314,"Really buggy right now. There's no way to create a party on the app, and I can't even join one. The website can't seem to log me in and if I click on any of the links on the FAQ page, it takes me back to the homepage. Also, tasks are listed in the order which I put them and not in the order that they expire.. so I have to check each task for the date and time of expiry. Not only that, the dates are displayed weirdly.. some have dd/mm/yy format while others have mm/dd/yy. Developers have much work to do.",,
315,"Hardly Find a Spesific addres This is a great app.  I already purchase and download Indonesia Map Pack  however.. its very hard to search spesific road or addres.  in indonesia, so many road name are excatly similiar, and the app cant find the best result for the road name or addres if you can improve serach location like google map does, it reallllly helpful",,
316,Was my go-to maps application until (as of this week) out started crashing as soon as the app was started. Whipping local data or even full reinstall from Google play gets me the welcome screens and a crash after those. Unusable.,,
317,"The actual maps are pretty good but I have two main gripes with the app: too many Street and place names disappear when zoomed out, and I find the search useless. My issue with search is that unless you know exactly what a place is called in the map, you won't be able to find it ( for example I tried searching ""cn tower"" and C.N. Tower"" and got 0 results).",,
318,"Great app but have some flaws In my case, I'm using Taiwan map with Chinese interface which display was perfect, but can not search specifically to NO.(number) level. It's annoying that I can only search and navigate by street names.",,
