70,"Just started using this app. Maps are great but I am unable to download any guides, maybe the server is down? Turn by turn directions are great but the app stops tracking movement when the screen is turned off to save battery. It would be great if it continued to track movement when the screen was off and also if the screen turned back on for a short while when approaching a turn. Maybe in the next update?",,
71,"Voice guidance during driving is not as good as on Google Maps, e.g. no ""turn left, then turn rught"" if next turn is immediately after current one. No voice advice and no sign like ""use the 2nd lane to turn right"", if 2nd is better to, e.g. turn left then. Streets that I don't need to use for my way are hardly visible during navigation which makes harder to compare map to actual turns on my way and consequently makes harder to define whether actual turn I approach is the one map talks about or it's the next one. Please don't hide turns that are not part of the route! Until that I prefer other navigation apps. Text on the map made adjustable - thanks.",,
72,"It's good but..... It's good but some more improvements required such as edit post quickly...... I am using wp but when I trying to edit previous post,option shows but not edit another problem is setting, view site,user options not working  and site stats shows too late please upgrade it's suddenly.",,
73,"The app is not as good as the web browser version, since the app does not show all of the info about a subject and is missing key links/heading to get to that info. IE: After searching for a television season, with multiple seasons, I was unable to go specifically to that season's page to see each individual episode, even though on the web browser version, there was a link by each season in the Season List Heading, which does not show up in the app version, therefore I will uninstall the app.",,
74,"Improvement needed The apps should add the function of history, favourite button in a way that is easily access or using opera would be way better than this apps. At least give us the scroll bar indicator which is definitely necessary. Maybe also a button for random page and a different layout for the portal pages. It would be nice if the apps can let us download the page as pdf directly. Put more resources in developing this apps. Thanks.",,
75,positive: - search function is fast - house numbers are building shape are really accurate - download of maps only if needed negative: - strange routing algorithm (it's fast but not so good). example: from Ingolstadt to Stuttgart almost no Highways are used. it recommends to go via NÃ¶rdlingen (takes 20 minutes longer than using A8 via Augsburg). - some oneway streets are marked wrong. edit: I installed the last version (9.1.8) and still the route between IN and Stuttgart without A8.,,
76,"This app use to be amazing. I used it for 2 years while traveling, but now it seems they just don't care. The app has become so slow to do anything. Sometimes taking over a minute to even load the search function. As soon as you resize the map everything disappears and you have to wait another minute for it to come back. All of this use to be instant. For an offline map the only thing they seem to be updating is online features like traffic and stuff. Its basically becoming useless. Instead of deleting it I have decided to post this review in hopes that they will fix it. This was once my go-to app for everything. Now I can't even use it",,
77,"Up until recently, this app was the single best way to use Wikipedia, and I would have gladly given it 100/5 stars; it was amongst my top 3 most used apps.  However, lately, likely as the result of some update, it will spontaneously crash roughly 1 out of 3 times I open a new tab, and, even worse, roughly 8 out of 10 times I attempt to add an article to a reading list.  In each case, when the app is restarted, it will have reverted to a state prior to the current session. Since, while exploring a new subject, it crashes as often as twice per minute, it has effectively become nigh unusable. The current 3-star rating I've given is an average, in the hope that this issue will be addressed soon: when working properly, it is easily a 5-star app, but in its current state, I wouldn't give it a single one.  Please implement a fix for this issue ASAP, it is an irreplaceable tool for kickstarting research on a new subject!",,
78,"Blatant internal storage hog.  Each time the app is updated, it decides to fill up the internal phone storage, rather than the the SD card. And following an app update, you then MUST re-download ALL previously downloaded apps, and again, fill up the phone storage not the SD.  At over half a Gigabyte of app and mapping data, this app is just blatantly greedy, and the developers are either too lazy or too incompetent to design an app appropriately to store directly on exterior SD card storage. ----------- WHY do I have to download maps again following app update?  EDIT: why also the need to automatically start up at boot?  This app is getting very tiresome to use - weekly updates, repeatedly having to download all previous map files after every app update, frequent nag screens.  Just develop a simple app - which works properly, doesn't nag its users, and doesn't gobble up huge amounts of data!",,
79,"This latest version changed my default map location from SD card to main memory, then told me I didn't have enough memory to update my maps, although this version only updates changes. I then had to download my maps again after changing the location, as it STILL doesn't recognise that I already have downloaded maps!  Just to add that I have used maps from my sdcard correctly for a few years now!  This rating only applies to the latest version which screwed up my configuration. This forced me to re download maps that are already on my sdcard, as even after changing the location back to the sdcard, the app still didn't check for the existent of valid maps in the selected location.",,
80,Big issue. I have this big issue that Is very poor of this app... I was driving and it took me through footpath though on car and I got stuck on the way and had to leave my car and continue on foot since I didn't have any other option... I suggest you integrate Google maps in this app because it can't find some locations like my church. I had to use Google maps and bookmark it in this app before I couldn't get lost anymore but the other problem is it deleted the bookmark without my permission..,,
81,"I started using this 2 years ago, and it was very good then. With recent updates the quality of routes for pedestrians has declined sharply.  I was recently in Manchester and could see my destination 100m down the street, yet maps.me wanted me walk 250m round a block. It was giving me a driving route, although I checked, it was set to pedestrians.  The version of a year ago was better for walking.",,
82,The only reason to download this app is to upload my comment. I am fine with reading Wikipedia on browser. You are forcing us to use your app and one day i will change my preference to study or search. I dont want to download any app in my  cellphone. Stop redirecting us to your app page and stop forcing us to use your app. You will face the same future that MAKE MY TRIP app faced....,,
83,"Google Maps It Isn't!!! Does anyone who writes reviews for apps ever actually use them for more than 2 minutes before they write the review?   They couldn't have for this app because it flat out does not work!   I read all the glowing reviews about this app and decided to buy it.  Bad choice!  If you live in the U.S. and plan to use this app offline to find street addresses it won't work. Period.  I tried several addresses in the metro area where I live and it found none of them!  It will sometimes find the street name but if there are several streets with the same name it will list them all and you somehow have to figure out which, if any, is close to what you're looking for.   And, Google, wonderful company that it is (not!) gives you a whopping 15 minutes to try out the app and get a refund if you don't like it.  At minute 16, it's yours forever!   How does a company like Google succeed, with business practices like this?!!  Horrendous!   If you expect this app to work anything like Google Maps or Mapquest, forget it, don't buy this app!",,
84,"""Best App of 2014""? I'd sure hate to see the worst! I'm guessing the reviewers who rated it #1 tested it exclusively in one state because this GPS app can't even cross map boundaries. If you want to go from Burbank to Las Vegas, you'll have to set up the California portion, then a separate Nevada portion. Unbelievable. Selecting a destination is an awkward process that involves manipulating the map. Sheesh! The best Android GPS I've found so far is ""MapFactor GPS Navigation"", which provides a variety of ways (such as Google Search) to quickly select any number of waypoints and destinations, plus traveling between states is not a problem.",,
85,"I also agree that the app does not work as it used to. Previously you would enter the street number, name and town and it would come up but it now just gives multiple options none of them what you want nor does not give any reference to the town other than the main capital city which means you have to enter everyone until the correct one is found. It used to be a very good app and I used it constantly overseas but now I cannot as I cannot trust it will get me to where I need to go. I tried the OpenStreetMap you mentioned in the previous post and it gives me no option to tell anyone nor does it bring up the requested address.",,
86,"God, I love Wikipedia, but... This app is way below its potential awesomeness. When I hit the back button, one of two things happens: either I am kicked all the way back to the main page, or back to the previous article, but not where I left off. If I ever want to follow a link in an article, then navigate back to that article, I have to search for it again. How can a site as well developed as Wikipedia not have an app with a working 'back' function? And Wikipedia's only response is ""Hey, we're open source, YOU edit it, users!""",,
87,Gnomes can't fight the Trolls Can not figure out how to edit the stupid sub titles that appear under the articles main title. Only the app version has this issue. I also miss how clean and clear the pages used to be. Now there's bars blocking the page for too long and tabs are harder to get to,,
88,"severely flawed app I was favorably impressed with the quality of the maps that came with Maps with Me Light; so, I ordered the full version.  However, I found that full version severely flawed. While the program correctly identified my being at my home, and while it correctly identified the name of the street I was on, when I tried to search for my full address, including the house number, it could not find the address and suggested similarly named streets in other towns. When I asked for the Walgreen pharmacy, it identified such pharmacies in distances of over 4 miles, but failed to identify the pharmacy that is less than half a mile from where I was. When I asked for restaurants, it failed to identify the 99 Restaurant two blocks away from my home, while identifying another restaurants offer the same chain, several miles away.  In my opinion, the application completely failed the test. If I were in an unfamiliar city, (which is the point of a mapping application), I need to find the nearest gas station, ATM, pharmacy, or a specific address. If I cannot rely on Maps with Me to do that, I have no use for it. I have requested cancellation of my purchase.",,
89,"Meh... I ended up using Google Map for the whole trip Search results are terrible. I keep getting many churches for POI or street names instead of the actual places. It couldn't find state parks or national parks visitor centers.  Can't see all the search results on the map. Can't input address. And there's no direction to the place, which makes the app even more useless.",,
90,"Settings don't save Incredibly annoying that my KM to Miles & hide zoom settings get reset as soon as I make a search. Also wish the searching was programmed to find words in a sentence and not exact phrases; couldnt find a result for ""tokyo tower"", once I manually found the location it had Tokyo Tower in parenthesis. Knows a lot of places though. Also REALLY wish the search button wasn't like 3 clicks away should be default on the maps screen",,
91,"I didn't like this app at all. I am in Adelaide South Australia and  downloaded the right map for my state. I wanted to look for Victoria Street  and typed it in, and the search results came back with about 30 results but  they listed them all as being Adelaide, South Australia. It should have  come up with every suburb that contains a Victoria Street in it, but listed  everything as simply being in Adelaide, South Australia. I don't have the  time and inclination to go through 30 search results to find the right  suburb.",,
92,"Well after down loading this app I tried to get a route from Benidorm to my house in Balsicas, Murcia, and it would not recognise my Calle. So I looked on the map area only to find my street has the wrong name and the name of the street is shown as a street one block away. As one is supposed to be able to correct errors how does one do this? as I can't find any instruction to allow me to correct this error. May be able to up grade star rating when I have used it.",,
93,"Very fast map display, somewhat slow routing. I experienced completely bogus routes jumping from a surface road onto a bridge passing over it (without a ramp existing - and also visibly not existing in the map display). Reported multiple times, still not fixed after almost a full year. Can't trust the routing engine. Apparently, integrating stuff to appeal to businesses is more important. Finally uninstalling and switching to HERE. Response to dev's comment: Was using latest update/maps. Older version likely on wife's device. Will contact support with details.",,
94,"MALWARE APP!!!: IT SENDS YOU VIRUSES AND SPAMWARE Y 30 DIFFERENTE LANGUAGES, THE ANTIVIRUS DETECTS IT AS MALWARE, STAY AWAY!!! REPORTED !!!  I do not want popups asking me if I have thought about where I am going this weekend. Deleting it now. Remove this idiotic nonsense and I will reinstall and re-rate it.  also: CRASHES CONSTANTLY WHEN GOING TO SETTINGS. no audio instructions for turn by turn navigation? offline search is poor. download of maps extremely slow. Markers on map should be ordered by nearest to my location, etc. Markers search is poor, they re all scrambled.",,
95,"The experience of using the app is amazing. I can access my admin version of the site and start publishing or scheduling, or even adding a draft to set up with getting back with my computer. I can even monitor my stats to see what I can make for improvements or data collection. I can make or delete pages anytime I would feel. See notifications etc. What I don't like is the bugs and errors when I want to edit something. Its frustrating and I think it may factor in in messing up my set up.",,
96,"Getting there but not quite there yet... I hate Google maps. Somehow it's slow on almost any device i have used. Right now I'm using nexus 7 and it's still slow, even with the new update. Mapswithme, on the other hand, is mighty fast but lacks in map data quantity, quality and the fact that the search function is useless. The only way I've found it useful is to search for the street only, but even then you have to magically deduce which city it's located in by the distance from your position alone. It's not very precise, also. In addition, i haven't found a way to change the measurements to km's, so that's that.  Last, but not least - there's no decent navigation (the rotation of the screen doesn't count).",,
97,"There is an issue with external links & lists & categories. This app is pretty good for the most part. I love offline reading, I love how easy this is to use. But, I often use categories from Wikipedia, but this app had removed all pages from Category:[Whatever] lists. It makes the app harder to use. As well, I often check out external links, to check primary sources, or just read original articles. But those links are either broken or disabled, and I can't change this feature in settings.",,
98,"Doesn't post a new blog if I clear the 'uploading...' notification The new blog posting process is somehow interrupted and doesn't finish completely if I clear the 'uploading...' notification.  As a user I would assume that such a process should continue in the background.  Next, if I open the app again, it doesn't show any indication of the ongoing process which doesn't give me any kind of update (of whether the new blog got completely/half way uploaded/or cancelled).  To check this, if I manually click the 'refresh' icon on top-right corner, it gives a warning message which is really doesn't help the user what his/her action should be.",,
99,"I've Had The Wikipedia App For A While. I Really Never Used The App That Much. I Mainly Used The Website. So I Was Looking At An Article And Accidentally Clicked The Edit Button While Scrolling Down And It Said You Have Been Banned From Editing. I Thought It Could Of Been A Glitch So I Opened The App And Went To Suggested Edits And It Said My Account Was Blocked. I Attempted To Make A New Account Since I Thought This Was A Mistake. I Looked Into It, And It Said I Was Blocked. Dont Get This App!",,
100,"I want to love this app, but can't. Searching has too many problems: locations don't return results, and switching between map/list view makes some entries disappear. I love the spirit of this app, but without reliable search, I cant use it. UPDATE: I worked with support for 3 separate bugs. They were pleasant and prompt, but 2 of the issues remain, and they are deal-breakers for me. I genuinely look forward to using this app in a year or two when its more reliable.",,
101,"Maps are stored on internal memory by default. Even when app itself is moved to SD. There is no option in settings to change the location of maps to SD card.     App has to be open all the time during maps download. If you move to other app download stops and has to be started from the very beginning.  Maps are not downloaded in background. Leaving screen with download progress shown resets download from say 50 % to 0%, meaning you cannot use your phone during maps downloading process untill it completely finished.",,
102,"Clunky I have no idea how this has a 4.6 star rating. There's no importing of favorite places. Very unintuitive to set your favorites like home and work. Not user friendly to navigate to your favorites. The voice is very unnatural sounding. Turn directions do not include street name that you're turning onto. Distances read out in feet instead of miles (""turn left in 3000 feet"" vs. 1/2 mile). Finally, it's worse than Google maps about unnecessarily telling you to keep left to stay on the interstate at off ramps.",,
103,"Just hate it... Not intuitive enough, I made couple of ""mistakes"" that got me headaches. First one, I started a post, and I wanted to save it, so I pressed the arrow in the up corner to acces next options, but that icon is a ""paper airplane"" that publish the post without even ask! Alright, first use... I search for something like post adjustments (oh, they were in the footer!), and changed the post to local draft. But it NEVER went to draft again in the blog!. Worst than that, I continued editing it, and the next time I accessed it, a message appeared, something like ""the post is not updated, do you want to?"" and I thought of course, upload the changes, but what it did was download the first draft (the published one) overwriting the last one so I completely lost ALL of my work. ""Well, let's see the revisions..."" but there's NOTHING like that. On top of all that, I searched the internet for help, and the only possible solution needed my device rooted before all this, and search some hidden directories, but it comes to happen that there are lots of people who doesn't even know what is to root an android device. ABSOLUTELY AWFUL!!!",,
104,"Needs a long way to go. Many street names are missing. The font size is way toooo small - just not useable. I want to travel to Thailand but because of the lack of street names and small font size there is no way that i could use it on my Samsung Galaxy Tab2 with 7 inch screen. At the best it gives me a general idea. It displays English as well as the local language which means nothing to me and only serves to clutter the map. In my home country, Australia, many street names are missing so it is of no use at all. In my opinion if you are going to create an app then at least do a good job. Much better to start small and do one country well first before taking on the whole world.   :-)",,
105,This was the perfect Wikipedia app till recent update. Every time you search something new it'll open a new page and honestly is annoying no need for that. Go back to how it was. We're here to read and find out new things not have 100 windows open for no reason.,,
106,"Handy, But Feature Poor [PROS] Offline Viewing (save pages).  [REQUESTS] Tabs (multiple); History (option to remember, not restart at home page on every launch); Bookmarks (in addition to offline viewing); Scroll (add indicator, and fast scroll handle); Appearance (optional white font on black background); Font Size (fine adjustment between 100-150% and/or pinch zoom).  Maybe use Repligo Reader as UI template, or even collaborate / create plug in.  Also compare to Pocket.",,
107,"Excellent offline access, mediocre travel tool It's really nice not to have to have a WiFi connection to access detailed maps. You can download just the areas you need to your internal or external storage and always have access (the KitKat external SD ""sandbox"" is supported).  The map will follow your position if you have location enabled.  One serious flaw is the inability to interpret address info being sent from other applications, so you can't use this application as your default map.  Links from calendar, e-mail, and browser apps will just go to the middle of the ocean near Africa at Lat/Lon 0/0).  Another issue is cross-map routing: you can't plan a route across state or country boundaries that cross map files.",,
108,"Yet to be convinced... This seems to be an interesting app, no doubt, BUT it does not work for me. Why? 1. Font size hopelessly small even for a 5.2-inch smartphone screen. Maybe on a ten-inch tablet... 2. No options for routes (fastest, shortest, easiest..). It seems to automatically opt for shortest routes, which are not always the most convenient. 3. Searches of POIs return vague names (like ""Gas station"" without the brand, or ""Parking"" without immediate street indication. 4. No voice guidance for Romanian. Uninstalled for now",,
109,"Could have been better Purchase the Pro version because sometimes internet/Google Maps is not always accessible. The maps looks good at first glance, especially it has street number in the map. The most unbearable problem so far is the poor searching function: tried to find a certain address but the map can not actively find the exact location and re-center the map to the target location. Moreover, it seems that the app does not recognize the address at all and do nothing. If you can not even search an address then this maps in a sense is crippled. My cell phone is LG G3, Android 4.4.2, had already loaded with the maps used for address searching.",,
110,"Really unique app that motivates me to get stuff done. Unfortunately, this app needs A LOT of work. I tried writing a message in a guild chat. Once it got long enough, the words disappeared behind my keyboard so I couldn't see what I was writing. When I put the keyboard down, the send button disappeared..as a result I couldn't send my message. Theres no search for trying to find a challenge that suits you. Theres no notifications when your party is chatting. There is also no search for guilds. I just started this app and so for these are the problems I've noticed. Otherwise it is great and I hope it improves.",,
111,"Pictures don't display when clicked on and... The inability to keep multiple tabs open drives me nuts. I'm a college student and this app is terrible if you're using Wiki to research. God help you if you go to another article from one page- when you hit the back button, you start at the top of the first article ALL OVER AGAIN! Not saving my place in the article, especially if it's a long one or you don't remember exactly where you stopped reading is a nightmare! I love Wiki, but I  don't love this app.",,
112,The map itself is good. thus it can not choose the route between highway and a free road.  the main problem is. before i was sighn in into a google from this app. to keep organised my bookmarks.  now my phone was little broke. i reinstall android 6.0 OS to my phone. then i reinstall maps.me and then. i was trying to sighn in into a google service from the app. to retrieve my bookmarks. but i get a message from google.   that they not support this app anymore. because only browsers permitted to make authorisation requests to google. it's classifieds as embedded user agent also known as a web-view.    anyway i can't get my bookmarks back. not allowed anymore. and google authorisation still there. kind of useless now for me.,,
