156,"I'm not basing this rating on Wikipedia's political biases. It's annoying that a new search actually opens a new page instead of replacing the current one. I'm deleting the app because it doesn't support ""find in page"" when viewing. That makes the web browser much more useful than the app. They are adding that function when editing, so the code is already there. It is not implemented to force viewers to scan the whole article.",,
157,"Here's another example of it's not broken, dont fix it. Regarding the interface changes, it's a mobile app. Why would you move the new tab button to the top left, and the open in new tab to the bottom left? It's not that I'm too lazy to reach a little further with my finger, but why would you move something that was in a convenient location to one that's isnt? I usually dont update my apps unless I have to and decided to, and regret it. It's not a huge deal, it just doesnt make sense to me. (Unless the developer had a smartphone with a small screen and is a lefty)",,
158,"Block Editor seemed alright. But user has very LIMITED options over control on what text's font, colors, style, and types of separator, line spacing setting, and inability to implement line breaks in 1 paragraph block without starting a new block which is on another separate line spacing. It still has an issue with merging the given format from Classic Editor and comes up with Error Block when User fix the broken paragraphs caused by Block Editor's uses.",,
159,"Gallery creation/modification missing, Nexus 4 video upload doesn't work	On the whole, the UI is clear and nicely built, but two basics things I use most are missing/not working: - Creating a gallery necessitates first googling the workaround in their support forums (i.e. (1) attach multiple photos, (2) save as draft; this uploads images and links them to this post, (3) edit post replacing all code with just [gallery]; this uses all linked images (4) publish) - editing a gallery is impossible (just recreate using workaround) - uploading videos on my device doesn't work (invalid file type error), nor does the ""quick video"" function (can not retrieve media)",,
160,"Slow and broken for long distance travel. App slows randomly and takes forever to find a path. When you search for a location and see the name of the place you want to go to, you can't select until it loads all other relevant locations related to the query which wastes around 10 seconds. I'm using a PCT L29 Huawei phone for reference with the whole map downloaded with over 40gb of free space and no other application running. This is a terrible app. Use Google maps instead.",,
161,"Not giving five stars. You've still got bugs. In 'My Profile' section, I can't correct notification settings as, half of the blogs I follow don't show up. I have to go to my PC & do it from there. Next, the news feed isn't complete. It will show me some new posts then, it jumps to three days later. Next, when I try to upload pix and make a post, WHY is there all of this extra HTML nonsense? Next, I changed my profile icon on the PC (not site icon). Why doesn't it show up here?",,
162,"This is terribly buggy and you're better off avoiding it; use the website instead, if you're on your mobile device. Latest update doesn't update habit counters on-screen after you press any buttons; all of the command is processed though. App still doesn't display items that are found. Just another buggy update.",,
163,Introduces one to a world of interesting people. I like the app but wonder sometimes why WordPress suggests that I share posts on social media to increase views when I have done so to several sites the day before and had multiple comments and likes on those sites but WP shows me having less than one-third as many views or worse. People follow my blog or like a specific post but somehow there are no views that day. The notifications are useful but sometimes seem inaccurate.,,
164,I like the app and it works well for me to set things up . I have published an about me section and a blog post. It shows up on my end but when I try to view it externally it just says that a new wordpress site is coming. I just wish that when it's published on my end that it also publishes online. Now I have to figure out how to get my blog online so others can view it too.,,
165,"It's fine. It seems unfinished sometimes. The lack of street names in the voice navigation makes it hard to use for navigation unless you have someone with you to be the navigator and tell you what the app is showing. The lack of street names also makes it unusable for navigation on my motorcycle where I depend solely on the voice prompts. To clarify, the streets were named in the app, and they even flashed across the top of the screen, they just weren't spoken in the voice prompts.",,
166,The ads have become very intrusive. An important part of the screen has the ad and it is difficult to select a map function without hitting the ad. It isn't worth it anymore.  Trip planning is an exercise in patience.It is repeatedly suggested that I download my current location not the country map I am trying to work with for a vacation.  Everything is a charge! The UI is not very intuitive and trying to select a route between 2 bookmarked locations - well - I still haven't figured that out!  Really - Google Editor Choice? Methinks not!,,
167,"EDITED- SOMETHING IS WRONG. POSTS ARE NOT POSTING, PICTURES ARE NOT UPLOADING, PEOPLE ARE NOT ABLE TO VIEW POSTS. PLEASE FIX. Wonderful. I like the upgraded version of this app. I've used WordPress for years but your new step forward is amazing. Just a little request though. PLEASE ADD 'SHARE' OPTION IN SITE PAGES SO THAT WE COULD SHARE LINKS OF OUR INDIVIDUAL SITE PAGES FROM THE APP FOR THOSE OF US MANAGING MULTIPLE PAGES IN ONE WEBSITE. THANKS.",,
168,"Search needs work The maps are good and they load fast but the search is frustrating. If I type in a street it will list streets and their distances but will just say for instance ""USA, Massachusetts"" and not list the city! So you end up with 20 results and have to guess which one is in the town you want. One fix is to load the city first then search ""on screen"" but this should be fixed with an update.",,
169,"Perfect App, Battery Drain Amazing mapping for offline, but impossible to shut down once it's started without restarting device, generally between 18% and 35% of batter usage on the Tab S 8.4 is drained by this little app alone, and can't be stopped. Routing is useless, sends you down small back roads and city streets when highways would be faster.",,
170,"Great for visiting a foreign country! It is a perfect app for travelling abroad!! Thanks a lot!! However i experienced some problems: i can't share bookmark sets with my friends! They can share with me anything but i can share with them only individual bookmarks, one by one... very anoying when you have a lot to share. mails, dropbox, google drive... everything is either telling that the file is empty or failed to upload... another thing is that when i moved the maps storage from the device to the sdcard, i lost all my bookmarks :-(",,
171,"Dear Sirs When I select a word in one of your articles, a window appears allowing me to Define that word. If I select ""Define"", a small window opens with a complete definition in it, of several lines in length, typically. This option is of course, very useful. Nevertheless it does not allow me to copy that definition so that I can store it for my own personal studies. It allows me to copy one sentence or one example or one item on the long list of information regarding that word, but it does not allow me to copy the word with its complete definitions. Moreover, whenever I contact the developer directly with a bug report, I am just given the same generic answer, namely: ""This appears to be an issue with your phone software or hardware as opposed to Wikipedia and I am afraid we are unable to help. Yours sincerely, Chrissy Anderson""",,
172,"Almost perfect... but worse than before Indeed, the offline service used to be more reliable on previous version. Several pages are not saved even though it has been asked to be. Itnis mandatory to create a ""reading list"" which make longer both  saving process and browsing, and if previously the ""bookmark"" button located at the top of the article also allowed to UNsave the article (once read for instance) it is not a pain in the ... to delete a page.   Please consider giving back this button its complete and efficient ability. It would be perfect",,
173,get rid of that awful button on the side for fast scrolling. everytime i read an article i accidently touch it making me loose where i was. bloody annoying and a major fail. bring back the swipe feature. i am not enjoying your mobile version any longer. deleted. went back to web based.,,
174,"Wikipedia is cool ,but this app needs work Tried to save a page the app informs no pages have been saved yet , nice . Getting rid of the page saving feature until it is one would be way cool ! Sculptor named arnson did not suggest proper spelling arneson no such page result . Odd google can locate arneson Wikipedia page but this app couldn't despite hints Moscone's bust come on wiki has got to be ashamed nothing on arneson showed up with that search . No way to suggest improve without using a pc or review possibly . Doubt this will work cause explaining phonix to Google and msn so they could fix their spell check system failed . Kaller id on the fone is simple to guess the proper correction if phonic is figured in . Wikipedia said a person who claimed pigeons are superior friends has people who enjoy biting live birds heads off feeling kinship enough to fund building a monument to Nikolai esla sound's like the perfect sick joke . Yes meaning of geek during Nikolai Tesla life requires download of dictionary published before the end of the 60s is sad . 80s probably was good cause the world's most famous geek ever Ozzie Osborne was active at his geek career . Tesla be insulted by geek existence is safe bet ,enjoy your chicken",,
175,"FIX READING LISTS New update to Saved Pages (now called Reading Lists) has messed everything up. I had nearly 300 saved pages and now they are in no order at all. I can't find anything now. Even the Search Saved Pages function is gone. And every time I open a page, that article moves to the bottom of the list for no reason. I like the idea of multiple reading lists, but I'd like the option to sort alphabetically, or better yet, to be able to arrange them into any order I choose.",,
176,"It's mostly OK. This cannot fully replace the web dashboard. But I think it is OK as a mobile companion app. You can do all basic tasks, like managing your blogs, notifications, comments, etc. with this app. I just wish it could upload multiple media files. A separate html mode in post editor would be very great. It also has upload problems from time to time. Would be great if those can be added/fixed :-)",,
177,"Really great and helpful app, I'll recommend it for anyone. I also love that it saves work automatically even if you phone shutsdown. But sometimes it gets a little annoying when you type and are all ready to post, then it publishes a previous version of your saved work - and not the latest one. But I really enjoy using it and navigating. Thank you for making my work easy, I no write from the train, the bus, I don't have to carry a laptop around everytime",,
178,"Nothing Special, Sadly As obvious as it is that a great deal of work has been put into this app, I feel its development is in a bit of the ""can't see the forest for the trees"" stage. Without support for custom fields, taxonomies, and post typesâ€”and no support in sight, as far as I knowâ€”this app quickly becomes useless to a great many bloggers. Stats are great. Comments are great. Being able to actually update your website with new content outside of Posts and Pages is better.",,
179,"Ok for simple text but shear horror if you want to upload images.Upload is interrupted most of the time leaves the local media cache completely broken.No easy upload of multiple images (workaround via filemanager share dialog), no progress bar on upload (no idea if finished, incomplete or still working).Crashes if accidentally refresh media library during upload. Please devs, add a decent way to upload images with progress info and feedback if it was successful or failed. Otherwise it's a real pain in the ass to use the  app.",,
180,"Great tool but runs horribly on my phone at least - even after latest bug fix update. Super laggy to open keyboard on search, freezing and crashing often. Sometimes zoom buttons are missing or not in their usual screen location.",,
181,"I've been using Maps.me for about a month now as a backup to my Garmin as I travel around Europe. It does a decent job of helping you navigate around city's. However it is borderline useless when navigating great distances. It only offers one route and it is always the most direct route. That means if the most direct route is through the center of a massive city as supposed to using a ring road. It's taking you through the city. This has happened to me a few times while using maps.me and since I don't know the area it's bitten me in the ass almost everytime. Something that would take 30min using the ring roads instead takes 2hrs because you have to go through the whole city. It also has a very hard time rerouting. Several times I followed the road signs instead of the app and it refused to reroute, it didn't even reroute a turn around. It just kept spinning the map in circles. Like I said for city nav it's not bad, Google maps is better but this is a decent no data options. But for long drives I'd avoid this app.",,
182,"Updated review (2018-10-31): The new TOC is awful: there is no hierarchy, every item is on the same level, and there's way too much space wasted. I'm dropping my 5 stars down to 2 just because of that ; it's that awful. Please bring back the old TOC. --- Original review : This app before the last update was already the best Wikipedia app. Now with the table of contents available in the bottom bar, it's even better. Before, it was sometimes hard to make the table of contents button appear in the bottom right. Now the button is easier to get too.",,
183,"It used to be good and still is for basics but: 1) offline navigation instruction completely wrong. The voice says to go straight but instead you need to exit the motorway on the right. 2) rerouting takes too long time most of the times. The navigator keeps on following the route it expected despite the road I took is wrong (for the above mentioned reason). 3) expected time of arrival... the calculator is really negative at the beginning but optimistic after a few km... if I plan a 200km road, the first time indication is about 4hrs (or anyway higher than any reasonably possible time). After 100 or 120km, despite I'm still missing 80km road, the expected time of arrival drops to 1 minute.  Driving with your app has become hard!",,
184,This app is very good if you need a map while not connected to the web. This app has a long way to go. Update: I have had this app for sometime now and they have done a good job making it better. I find myself using it more often than when I first purchased it. I would go 3 1/2 stars if I could.,,
185,"I installed this app in the hope of avoiding google maps. In favour: map quality is excellent. Bookmarking places isn't very intuitive, but the real failure is lack of routing understanding. In the UK an app like this should have settings that create *sensible* route choices; nothing I found stopped it trying to send me from Wiltshire to Kent via central London. On paper the route looks ok; in the real world it involves a congestion charge and would take forever (subjectively). More work needed.",,
186,"Resets my phone frequently. Also, it has start-up (start after boot) permissions ? Why? It slows my phone.  There are two reasons to uninstall such kind application. Offline maps and navigation pretty good, but not enough. People, look at PERMISSIONS in App Manager and pay attention, firstly, when you install some new one: Google Play lists all.",,
187,Offline maps are good some map data is off ie street names that have been changed 5+ years ago. Address search is not working properly. Google is much better currently having to download off line areas. Will be only using for general map usage.,,
188,"Navigation is available only from your current location, you cant set another starting point for a route there is - NO route options for a route - like in google maps.  I found one app which has this and offline maps and for moment is free which i recommend after I have spent a afternoon with install and test of famous and good rated apps like Telnav, ex Skobler, Sygic, GPS Navigation from Bzing s.r.o. ex. Be-on road which miss basic function like the one mentioned before",,
189,"Useless search and routing function When I enter an address that I know is valid, app keeps giving a search error and tells me to change the search criteria...to what I have no idea. I read the help and entered the address according to the example, but no bueno. Google Maps has no problem with giving me routing intructions to that same address, but unfortunately, won't allow saving for offline use.",,
190,"Very frustrating. Wanted to start by organizing menu items because an apple user showed me how easy it was. Android app, I find out, has no option in the app. After meeting with the other user, we find out I have to go to ""independent publisher 2"" and get redirected to the browser. There, we find ""menu"" but am unable to open the items I create. Unable to delete items because tapping on the arrow drop down button on the right only works 1/1000 times. Not user friendly. Disappointing app experienc",,
191,The OSM based app anyone can use search for smaller towns and villagesl (names that also appear as street names) isn't possible as the street come first. Can't change map layers eg cycle view. Can't change colours eg in UK motorways should be blue. Long distance drive directions prefer A to (faster) M roads.,,
192,"Still no categories (updated 5/2016) 1.  Rather useless navigation without categories.  Especially when the list haters remove ""see also"" entries such as 'list of Foo"" with edit summary ""unnecessary.  Use categories"" 2. Search box not clear that it is a search box.  Need graphic/color distinction 3. No way to read/edit talk pages. 4. No way to access history screens.",,
193,"This app is very very limited in what it can do, compared to the site. Shame, considering users do most social media, photography and videography from mobile devices. There is no ability to link to other pages on the site when creating a new post, aside from manually entering the URL. Feature request: Bring up a list of links to choose from on our own site when tapping the link option.",,
194,"App looks useful thus far. Although, there are a couple issues over run into right off the bat. It seems I cannot delete habits/tasks/to dos in case I mess up on setting them up. Also, the guilds pages does not seem to work at all. I've attempted numerous tunes to join the first guild on the list, and nothing happens.",,
195,"App is so-so, value comes from the maps The application has a very limited feature set - basically the only thing that works (well) is showing the zero-cost OSM material. The app renders OK and quickly, but that is already all there is. Quite frankly, other apps based on the skobbler engine draw nicely and very smoothly. In many cases the offline cache of Google Maps is good enough (Japan) and in other areas Google Maps data can actually be downloaded explicitly for a defined region. There is massive room for improvement here.  [Adressing the response to the review: It is not that features are ""bad"". It is the lack of features which I am a bit unhappy about. Combine the (OSM data-driven) features of ""Locus Map"", ""GPS Navigation & Maps"" and ""MapFactor: GPS Navigation"" with the existing feature set and get a very nice app. Aggregate *more* data, make the OSM data more accessible, see for instance the email conversation we had three months ago. Just as an example - the Triposo applications have offline maps based on the (very nice) Skobbler engine. The data they aggregate is all crowd-sourced (i.e. of variable quality), but this app adds a tad bit more offline value.]",,
196,"I have been using this application for few days in Spain lately. After two days of usage I have sent a bug report to the developer. I was kind of expecting to get some response. Alas - no one came back to me. Here is my original bug report:  1 - the maps are very good, with very aesthetic and appealing view. Kudus! 2 .- I have received few times failures in planning a walk, and was advised to define a different start or end point.  I fail to understand both. 3. There is a very unstable behavior you need to solve. When walking along a planned path, even a very straight one, the view keep rotating clockwise and back. This is annoying behavior. 4. When walking along a plan path, the software does not take care to move the visible map window, therefore I have to take care of this. 5. It should be possible to decide which data layer is drawn. For example, when I look for a monument and the search can not find it and I want to finger choose it, I don't want to see icons of restaurants. 6. There should be integrated icon explanation. 7. I would expect a search that yields many results to sort them from close to far. In 99% of cases I need the closes",,
197,"Needs better support on yotaphone UPDATED 2 STARS REVIEW: After using this app for a few weeks on my old phone , I bought a new yotaphone 1 solely because of the native support of this app for the e ink display. I was hoping to use the e ink display as an energy saving GPS navigator. However I was soon saddened to find out that routing is not supported on the back display, and the maps that do display on the back do not automatically update to the current location.",,
198,"have to download small areas of one country one at a time to get routes. for example I tried to get route from Finland to U.K. but I works have to go all the countries along possible routes to get directions. You should add full area map downloads to be easier like Europe, north America, central and south America, Africa and Asia could be made in two Å£o five sections of download considering the area of those places and how large the areas are. other than that the app is great.",,
199,"Uber detailed maps, search needs tinkering By far the most detailed mapping, right down to stores, plazas, schools, even addresses along main roads. That said, the search and location save features need some work. Even saved locations wouldn't show on search, whereas HERE pops it up as soon as a similarity is detected, along with nearby options for food and services - and saving and renaming was a bit awkward. A cleaner color scheme choice would be awesome. The yellow tint in this map is awful with a screen filter.",,
200,"Hard to use Using maps offline is obviously useful however you often need to know addresses as many businesses aren't searchable. Many addresses copied directly from Google maps also aren't able to be found so addresses need to be simplified, but even this doesn't work sometimes. And the search and 'route to' functions are just generally temperamental and require multiple attempts to work. Improvements needed to make that app easier to use.",,
201,Why do updates make things worse Maybe its just me but since I updated this app I find I use it less and less..I came back to google play just to uninstall the update but its too late I guess....what I don't like is the homepage to an article where every topic is opened..yea I know its organized in the top right corner but because its such a long page it takes longer to load...before what ever I searched for I found in a second and every topic was well organized now it jus seems like its all over the place..I used to use this everyday..,,
202,"App can't open posts written with classic blocks. Posts still being set to a backdate by default (I can literally reproduce this behavior with EVERY SINGLE POST). No functionality for duplicate title slug detection. This literally gets worse with every ""update"". I miss the days where I could just use this app and it did what it was supposed to. One of the most consistently unreliable apps I've ever used.",,
203,"Background battery draining Constantly using gps thereby draining battery, on a new nexus 5x, denying location permission to the maps.me app removes the gps icon from the status bar, granting location permission instantly puts the location icon back and battery goes down very fast. Cleaning cache from recovery mode doesn't help. Only uninstall or denying gps helps. Maps.me was gradually getting worse and worse after they become free and now they reached the point of total unusability. That's sad. Gotta move on to an  alternative OSM",,
204,"I love this app. But you're starting to lose me. There are 3 major things wrong. 1)Redundant routes. Mainly on highways, interstates ect. Where the app tells you to exit and get off and then back on the same highway. Super inconvienent. 2)Navigation. Not having street names or #s along with voice nav leaves you guessing. 3)Off road eta. For some reason the algarythm inturprets unpaved roads to take hours to traverse. Misleading the driver with an inaccurate eta. Fix bugs and i edit",,
